{
  "schemaVersion": 1,
  "contract": "kfd.self-conformance-lifecycle-gate-report/v1",
  "profile": "kfd-self-conformance@1.0.0-alpha.1",
  "gateId": "recursive-normative-self-conformance-terminal",
  "lifecyclePath": "qualification",
  "requestRoot": "sha256:6de7f6436870f4ac5d0e608e631b787371eb318ff680a15b90db7e5b4aac8dc6",
  "fixedPackageRoot": "sha256:596a1e4b0d57e93fefcb4f32ff2df5be35a56cf86fb8864f5d0ab09b12cd8770",
  "terminalBundleRoot": "sha256:1dda7286370c7221d87539d4749fb07017f94238040e324c02fc633c19b797e9",
  "terminalReportRoot": "sha256:0fb85f2dbd11dba10648bbc85a7f8a563674d4b18c6d6dfe452c6db80b40d9bb",
  "valid": true,
  "outcome": "non-promotion",
  "transitionAdmissible": false,
  "automaticTransition": false,
  "verifierNecessary": true,
  "verifierSufficient": false,
  "humanApproved": false,
  "releaseAuthorized": false,
  "numberAllocated": false,
  "statusChanged": false,
  "chain": [
    {
      "index": 0,
      "transition": "candidate-genesis",
      "bundleRoot": "sha256:154809d0f44fcd39a08077e79390d9f0dd18dff6d3ca2229e9e1654b1557faf2",
      "reportRoot": "sha256:0fb85f2dbd11dba10648bbc85a7f8a563674d4b18c6d6dfe452c6db80b40d9bb",
      "packageRoot": "sha256:596a1e4b0d57e93fefcb4f32ff2df5be35a56cf86fb8864f5d0ab09b12cd8770",
      "authorityReceiptRoot": "sha256:7584445751699c88d126b02ecc5716acb3ae80a1501f7a6538f8eb95abb4c689",
      "reviewReceiptRoot": "sha256:f714cd1a32c4b7b1560e5597244d8826981c26cb0d77a0473ffbd2375c35d7b5",
      "verifierValid": true
    },
    {
      "index": 1,
      "transition": "no-new-kfd",
      "bundleRoot": "sha256:1dda7286370c7221d87539d4749fb07017f94238040e324c02fc633c19b797e9",
      "reportRoot": "sha256:0fb85f2dbd11dba10648bbc85a7f8a563674d4b18c6d6dfe452c6db80b40d9bb",
      "packageRoot": "sha256:596a1e4b0d57e93fefcb4f32ff2df5be35a56cf86fb8864f5d0ab09b12cd8770",
      "authorityReceiptRoot": "sha256:c1d0647da2403268db7367d2d236e1cd4f05b98d7f560c94c821095c57348079",
      "reviewReceiptRoot": "sha256:6119545041dfffd7fd7d45f37bf605bfabbf97784bcf5e887b9028e336811720",
      "verifierValid": true
    }
  ],
  "counterevidenceRoots": [
    "sha256:ea6b3c50588f2867527aad93469a7d5f5384c83b57e072c7348888380deacbb2"
  ],
  "checks": [
    {
      "id": "authority-receipt-contract",
      "status": "pass"
    },
    {
      "id": "authority-receipt-coordinates",
      "status": "pass"
    },
    {
      "id": "authority-receipt-root",
      "status": "pass"
    },
    {
      "id": "authority-role",
      "status": "pass"
    },
    {
      "id": "bootstrap-anchor",
      "status": "pass"
    },
    {
      "id": "chain-entry-contract",
      "status": "pass"
    },
    {
      "id": "counterevidence-roots",
      "status": "pass"
    },
    {
      "id": "entry-package-root",
      "status": "pass"
    },
    {
      "id": "exact-bundle-roots",
      "status": "pass"
    },
    {
      "id": "exact-report-roots",
      "status": "pass"
    },
    {
      "id": "exact-verifier-root",
      "status": "pass"
    },
    {
      "id": "fixed-package-root",
      "status": "pass"
    },
    {
      "id": "independent-review-receipt",
      "status": "pass"
    },
    {
      "id": "independent-transition-verifier",
      "status": "pass"
    },
    {
      "id": "lifecycle-path",
      "status": "pass"
    },
    {
      "id": "path-transition",
      "status": "pass"
    },
    {
      "id": "predecessor-roots",
      "status": "pass"
    },
    {
      "id": "predecessor-state",
      "status": "pass"
    },
    {
      "id": "request-contract",
      "status": "pass"
    },
    {
      "id": "review-receipt-contract",
      "status": "pass"
    },
    {
      "id": "review-receipt-coordinates",
      "status": "pass"
    },
    {
      "id": "review-receipt-root",
      "status": "pass"
    },
    {
      "id": "terminal-bundle-root",
      "status": "pass"
    },
    {
      "id": "transition-chain",
      "status": "pass"
    }
  ],
  "issues": [],
  "offline": true
}
