{
  "schemaVersion": 1,
  "contract": "kfd.self-conformance-lifecycle-gate-report/v1",
  "profile": "kfd-self-conformance@1.0.0-alpha.1",
  "gateId": "recursive-normative-self-conformance-genesis",
  "lifecyclePath": "candidate",
  "requestRoot": "sha256:4d00f631267f5cab971cf8dd3a035cb20955e333d6eddedf626ab2ade86e30f5",
  "fixedPackageRoot": "sha256:596a1e4b0d57e93fefcb4f32ff2df5be35a56cf86fb8864f5d0ab09b12cd8770",
  "terminalBundleRoot": "sha256:154809d0f44fcd39a08077e79390d9f0dd18dff6d3ca2229e9e1654b1557faf2",
  "terminalReportRoot": "sha256:0fb85f2dbd11dba10648bbc85a7f8a563674d4b18c6d6dfe452c6db80b40d9bb",
  "valid": true,
  "outcome": "proceed",
  "transitionAdmissible": true,
  "automaticTransition": false,
  "verifierNecessary": true,
  "verifierSufficient": false,
  "humanApproved": false,
  "releaseAuthorized": false,
  "numberAllocated": false,
  "statusChanged": false,
  "chain": [
    {
      "index": 0,
      "transition": "candidate-genesis",
      "bundleRoot": "sha256:154809d0f44fcd39a08077e79390d9f0dd18dff6d3ca2229e9e1654b1557faf2",
      "reportRoot": "sha256:0fb85f2dbd11dba10648bbc85a7f8a563674d4b18c6d6dfe452c6db80b40d9bb",
      "packageRoot": "sha256:596a1e4b0d57e93fefcb4f32ff2df5be35a56cf86fb8864f5d0ab09b12cd8770",
      "authorityReceiptRoot": "sha256:7584445751699c88d126b02ecc5716acb3ae80a1501f7a6538f8eb95abb4c689",
      "reviewReceiptRoot": "sha256:f714cd1a32c4b7b1560e5597244d8826981c26cb0d77a0473ffbd2375c35d7b5",
      "verifierValid": true
    }
  ],
  "counterevidenceRoots": [
    "sha256:d9be0670c15ba928b6b47b2e7d1dffb15543cf30c4afd1eeca991d5c75fbf65c"
  ],
  "checks": [
    {
      "id": "authority-receipt-contract",
      "status": "pass"
    },
    {
      "id": "authority-receipt-coordinates",
      "status": "pass"
    },
    {
      "id": "authority-receipt-root",
      "status": "pass"
    },
    {
      "id": "authority-role",
      "status": "pass"
    },
    {
      "id": "bootstrap-anchor",
      "status": "pass"
    },
    {
      "id": "chain-entry-contract",
      "status": "pass"
    },
    {
      "id": "counterevidence-roots",
      "status": "pass"
    },
    {
      "id": "entry-package-root",
      "status": "pass"
    },
    {
      "id": "exact-bundle-roots",
      "status": "pass"
    },
    {
      "id": "exact-report-roots",
      "status": "pass"
    },
    {
      "id": "exact-verifier-root",
      "status": "pass"
    },
    {
      "id": "fixed-package-root",
      "status": "pass"
    },
    {
      "id": "independent-review-receipt",
      "status": "pass"
    },
    {
      "id": "independent-transition-verifier",
      "status": "pass"
    },
    {
      "id": "lifecycle-path",
      "status": "pass"
    },
    {
      "id": "path-transition",
      "status": "pass"
    },
    {
      "id": "request-contract",
      "status": "pass"
    },
    {
      "id": "review-receipt-contract",
      "status": "pass"
    },
    {
      "id": "review-receipt-coordinates",
      "status": "pass"
    },
    {
      "id": "review-receipt-root",
      "status": "pass"
    },
    {
      "id": "terminal-bundle-root",
      "status": "pass"
    },
    {
      "id": "transition-chain",
      "status": "pass"
    }
  ],
  "issues": [],
  "offline": true
}
